history,score_A,score_B,human_ref_A,human_ref_B,labels,score_ratio
"Explain like I'm five years old: Since plastic doesn't biodegrade, why aren't more houses built with plastic instead of wood parts?",9,3,"Structural plastic is softer (weaker) and more expensive (or at least it was until the recent lumber shortage), and it's also susceptible to damage from UV rays in sunlight (plastic exposed to sunlight will become brittle and crack and break). Plastic with additives to deal with the UV are even more expensive.  We do use a lot of plastic in home construction, just not structurally. Plastic sheeting for moisture barrier, plastic water pipes, plastic (or more accurately polymer) electrical junction boxes, plastic (polymer) wire insulation, kitchen cabinet veneers are sometimes made of plastics, etc.",Because heating/cooling your home would be problematic.   I don't want to end up like a leftover in the back of the fridge.,1,3.0
Explain like I'm five years old: How did the restaurant industry convince the American population to pay their employees for them? Where did we buy into the tip system?,121,2669,"Short answer: it's left over from the Great Depression. There's several good explanations already here.    To everyone saying ""I would rather pay more and have the restaurants pay their servers directly"", I've got bad news. Several restaurants have tried that, and a lot of them couldn't keep good servers. Turns out, lots of people in the service industry like the current tipping model, that's why they stay in the service industry. (Myself included. I make on average $25/hr bartending. I'm a disabled college dropout with no trained skills. I can't make that kind of money anywhere that's not tip-based.) They lost staff, spent more money on payroll, raised prices, and didn't see an increase in customers. It wasn't beneficial for anyone.  https://www.google.com/amp/www.sandiegouniontribune.com/sdut-no-tipping-trend-now-at-more-restaurants-with-2016aug31-story,amp.html","A local brew pub recently switched to a ""no tip"" model here in the US and received  quite a bit of backlash about it. The owner wrote a pretty extensive blog post about why he did it and how he hopes to see it play out.   Some of his key reasons:    * There is enormous inequity in pay between the servers and the kitchen staff. * Tipping promotes discrimination and harassment. * Tipping has an ugly history rooted in classism and racism. * Tipping has very little if any influence on the quality of service * Earning tips is the source of motivation is only half the truth * A major cost for any restaurant is turnover * Working in hospitality is a respectable career that deserves a respectable pay  Edit: I know this doesn't directly explain the OP's question, but if you read the blog post it does a good job explaining some of the history and why America should change it's ways.",0,22.0578512397
"Explain like I'm five years old: Why do Home dishwashers need to take 3 hours? I know it’s for energy star requirements, but commercial machines get the job done in 90 seconds. Why the massive difference? Wouldn’t even a more powerful motor take less electricity for such a big time difference?",50,303,"They run on very hot water, use dangerous chemicals, and are far too forceful for normal dishes. That's part of why restaurant dishes and mugs are so thick.","Commercial dishwashers take 45 mins to heat up when you turn them on, then keep the water hot all day, which saves a massive amount of time in the wash cycle but uses a lot of power. domestic dishwashers heat the water every time.",0,6.06
Eli5 How exactly does Noise cancellation work? That too in such small airbuds,948,5,"You know how your headphones can reproduce any sound? Noise cancelling headphones have microphones to detect what outside sounds you're about to hear and then make the exact opposite sound at exactly the right time. Any sound (no matter how complex or loud) + its exact opposite = no sound at all, much like 5 + (-5) = 0.  I could get into superposition and all that, but that's probably beyond age 5.","The sound you hear is a wave that is a sum of all sounds around you. Waves have a few relevant properties: They travel at a known velocity, and they are additive.  To cancel such wave in your ear: we measure the wave just outside the ear and play its inverse with a small delay from the earphone. Notably, this only cancels the sound in a very small region around the inner side of the earphone. Everywhere else it adds its miniscule amount of more sound to the wave.  For best results: You need a good microphone in both earphones, and a good algorithm to slightly alter the wave, to mimic hiw it will be altered by the earlobe (as the in-ear earphone sound is not altered by the earlobe identically to the sound coming from the outside). Fortunately, we can tune this individually: place a second microphone inside each ear canal (near the very tip of the earphone), and measure which delay and which amplitude modifications reduce the sound the most.  A good analogue: Look at the waves in the see. Measure the height of the wave. If it is above the mean water level, push the water down with a paddle you have placed under the surface. If it is below, push the water up. If you move your paddle at just the right speed for a given measurement, you can destroy the wave around your paddle (whilst creating a new wave around your paddle, propagating outwards and adding a bit to the waves everywhere else in the sea).",1,189.6
"Explain like I'm five years old: If YETI can make a cup that keeps water cold or hot for hours and a cooler that holds ice for hours, then why aren’t we building houses with that same material?",16,8,You want to make a double walled vacuum sealed house out of steel?,"Lots of houses have insulation, but it's not as simple as a thermos. With a thermos there's one opening with an airtight cap and the bottle itself is fully opaque. Its goal is simply to prevent as much heat transfer between inside and outside as possible. Houses have multiple doors, windows, none of which seal perfectly. They have windows through which to radiate/absorb heat, and their occupants produce heat themselves.",1,2.0
"eli5: how is there only enough gold in the world to fit a cube under the Eiffel tower, when countries have gold reserves, gold jewellery is common and gold is frequently used in industrial appliances?",59,2,"One other piece not covered in other answers is that big cubes are a *lot* bigger than you think.  Start up Minecraft and lay out 100 blocks. That's not so hard. It'll take you, I dunno, a minute or two? And while it's not *short*, 100 blocks isn't some ridiculous distance, either.  Now, lay a 100 x 100 square of blocks. That's a hassle and a half. It's a minute for each row, so 100 rows is 100 minutes is about an hour and a half. That's a pretty big undertaking, even if you've got all the blocks.  Now, lay out a 100 x 100 x 100 *cube* of blocks. Uh-oh. That's 100 times your hour and a half, or 150 hours. That's more time than I've invested, total, on just about all the games on my Steam list. It's a *million* blocks.  A 1000 block line would take you ten minutes or so. A 1000x1000x1000 cube would take you 51 **years** of working on it eight hours a day.  If you make a cube twice as big on each side, you have 8x the volume. Ten times longer, you have *1000* times the volume.","How big is this cube? It is estimated that there are about 250,000 tonnes of known gold in the world (of which 200,000 tonne have been mined). That could fit into a cube if that cube is large enough.",1,29.5
"Explain like I'm five years old how is the US banking system not crippled by credit card fraud? I come from a country where most people don't have a credit card.  I cannot wrap my head around this documentary.  Now I get that credit card fraud *is* a big problem.  But if all you need is the card number to order stuff, and card numbers are so easy to come by as shown in the documentary, then why is not every single criminal in the US running a credit card fraud operation?  It seems super easy and low risk. Get a burner device, order stuff from public wifi, and don't be stupid about the delivery locations.",30,114,"I mean, you also have to remember that this particular scam was from back in the late '80s and early '90s.  Banks have gotten *considerably* better at detecting fraudulent charges now, and even for the charges that slip through the total amount of money lost is pretty insignificant.",OP that documentary is from 1992. Banking and Credit Systems have evolved substantially in 30 years. You're thinking the entire US banking system is still being ran like its the 1980s.,0,3.8
"Explain like I'm five years old: Why do humans tend to increase the tempo when clapping, chanting, or keeping the beat?",68,28,"The human brain keeps many “tempos” in and throughout our body. This typically applies to things we do unconsciously, such as our heartbeat, or things that we do semi-consciously, like our walking pace.  You know how your heart beat gets faster when you get excited? Typically all of the internal tempos in our brain start moving faster or slower depending on emotional state.  Songs that usually provoke clapping and chanting cause us to be excited, which is an emotional state that increases heart rate and other internal tempos.  One of the most difficult things for musicians to learn isn’t a brand new song, but rather how to keep correct tempos among songs for just this reason. We use metronomes when learning music to attempt to override our internal tempos, because those internal tempos if untrained may increase or decrease depending on how comfortable they may be with different parts of songs.","Musicians learn to mentally subdivide a beat into smaller divisions, which makes it easier to keep a steady tempo. This is especially important with slower tempos. Instead of counting “1, 2, 3, 4,” we count “1  e & a, 2 e & a...” (or something similar). Always thinking of the subdivisions keeps you from compressing the beats and speeding up. I don’t think non-musicians necessarily do this, which may account for the speeding up with group clapping.",1,2.4285714286
"Explain like I'm five years old What's so special about water and why is it the most important substance in industrial processes and life on Earth? It's practically used for everything; drinking, cooking, cleaning, chemical reactions, generating electricity and the list goes on...but what makes it so suitable for basically everything?",5,11,"Off the top of my head...  Availability and affordability, as it is the most common liquid on the planet.  Being a singular substance, rather than a mix of others, meaning it can be contaminated, but not destroyed, by most processes.  Relatively easy to purify, via filtering, boiling, etc.  Relatively non toxic.  Relatively non compressible as a liquid, which is useful in various applications.  Highly reusable in processes such as steam powered turbines.  I'm sure there are other particular chemical characteristics that make it useful in specific applications.","Water is an excellent solvent, many, many substances can be dissolved by it.  There is a humongous amount of water on the Earth.  As a result, it is one of the least expensive chemicals available.",0,2.2
Eli5 How does cyanide kill you,4,8,"Another thing to note: if you call the paramedics, their pulse ox sensor will read 100% oxygen. If you suspect cyanide poisoning, tell them!!! Same goes for carbon monoxide poisoning....you may be more flushed in CO poisoning, but sensors won't detect it.","Cyanide interferes with the Krebs cycle or cellular respiration in the mitochondria. This stops the conversion of glucose into ATP, the substance your cells use for energy. Since your cells only make enough ATP for 6 seconds at a time an interruption in the cycle is quickly fatal.",0,2.0
eli5 : where do bees go in the winter time ? i was always told they died out but surely they can’t all die cause then how would there be more bees next time ? do they hibernate?,1784,10,"In the case of honey bees, they do not hibernate. The colony begins to kick out most of the male drones. They are not needed since the colony will not be producing queens in winter, and they eat too much to keep around. The workers do retain a few drones in the colony. They condense themselves into a tight cluster, and sort of shiver together to generate warmth for the cluster. They move through the frames of stored honey, and when temperatures permit they race outside to eliminate and to gather water. Nectar is gathered in the warmer months and the bees fan it to evaporate the water in it. This becomes honey, and is a carbohydrate source. Pollen is also gathered and mixed with nectar, and packed into cells. It forms a yeasty-smelling, sweet “paste” called bee bread. This is a protein source, predominately used for raising brood. Workers also produce another type of food, royal jelly, from a gland in their heads. It’s a substance fed to all larvae for the first 3 days of their lives, and to queen bees until their cell is capped.   The workers, mated queen, and a handful of drones winter together with very little brood-rearing going on until spring, when the brood rearing begins again and the colony grows. Beekeepers sometimes stimulate early brood by providing artificial or natural pollen and sugar mixed equal pets by weight with water. This can be risky, because a sudden cold snap can make it difficult for the bees to warm all the brood. When the colony becomes large enough, it will then split in a swarm. This is when the old queen leaves with about half of the workers, and a new queen takes over the colony. This can happen more than once in a season, and generally ensures the colony has a young queen as winter approaches.  In the case of other quasi-social insects like wasps, bumbles, mason bees, etc, they don’t winter over together as a colony like true social insects (bees and ants). Instead, in the fall the bumbles begin to raise many queens. Those queens become mated, and each seeks out a secluded, safe space to spend the winter alone. The colony of workers dies at the first heavy frost, but the queens are safely hibernating. In spring, a mated queen will emerge and begin to build a nest. She will lay as many eggs as she can manage while building the nest out further and further. As her brood hatches, they begin to take over tasks like foraging, brood care, and nest building, until eventually the queen becomes an egg-laying machine. The workers build, forage, raise brood, and the queen’s sole purpose for the rest of her life is to lay eggs.","Bees hibernate in their hives/colonies over the winter. The honey they make from flower nectar during the warmer seasons serves as stored food for the bees, along with some pollen that they collect and store.  When we eat honey, we're eating the bee's food reserves.",1,178.4
"Explain like I'm five years old: London's population in 1900 was around 6 million, where did they all live?! I've seen maps of London at around this time and it is tiny compared to what it is now.  Was the population density a lot higher?  Did there used to be taller buildings?  It seems strange to imagine so many people packed into such a small space.  Ty",146,714,"Not specific to London, but here in North America population densities were crazy high per square meter of city space vs what we have now.  Like a factor of 20x higher.    Throughout the 1920s several of the 'problematic' city ordinances that urbanists like to hate on came into effect.  They came into effect to effectively ban or break up many of the dwelling that were catering to the underclass.  As an example, there were rooming houses dotted all over where one could rent a mattress on the floor for as little time as a night for what amounted to a couple bucks in today's money.  These houses would be stuffed to full of migrant workers and other assorted poor people.  Basically they were dens of disease, crime and filth and poverty.  They also represent the market providing shelter for the bottom of the barrel and for those who may not have the right skin tone to stay in better accommodations.  So, in parallel with the introduction of the car, the city passed zoning laws that forbade these places.  Now there were max limits to how many people could stay in a dwelling.  This shut down the boarding houses because the landlord can't make a go of it without jacking rates.  (If you can't have 100 people paying a dollar per night, then you need to find one guy to pay 100 per night.)   There were zones that industrial activity could take place and they must be separated from where people lived forcing folks to travel longer distances from home to job.  People use to have 'servant' quarters in their back yard, but banned.    This is kind of a poor explanation, but hopefully it gives some kind of a sense of what happened.  At the end of the day, some of the changes were needed to combat rampant social disorder, but many of the changes were pushed to the extreme in order to try and entirely eliminate the 'undesirable' parts of the population.  The problem has been that we've now created a system that nobody but the rich can afford to live.","They crammed everyone close together. For those homeless/sleeping rough:  Penny sit-up: You could rest sitting on a bench but could not lay down, or really sleep (sleeping wasn't including in the price)  Twopenny hangover: you would sleep hanging over a rope for two pennies  Four-penny coffin: finally some rest laying down packed like sardines, infested with bugs though (so said Orwell)  https://www.historic-uk.com/CultureUK/Two-Penny-Hangover/  This is for Victorian age but it continued into the 20th century (and tbf, so did the Victorian age)",0,4.8904109589
Explain like I'm five years old: How come humans are disgusted by the idea of eating food that's already been chewed by someone else but animals have no problem with it?,3,15,Because we know about germs.  And it's taught to us at from a young age not to eat after other people.,"We are aware that other humans can contain diseases that can be transmitted through saliva. Moreover, we prefer to eat well-presented food from a young age, so seeing something chewed can be unappetizing. For some people, this is also true when they see their own chewed food.",0,5.0
Explain like I'm five years old: How do medical professionals seem to accurately predict when someone “is getting close “ to dying when the cause of death is vague such as old age or a long suffered disease?,828,144,"Nurse here.   When we say that someone is going to die soon, what we're really saying is that there is nothing left that we can do to save them. Particularly in cases of old age or a long illness, the person has been kept alive, at least in part, by medical intervention. Medications, surgeries, medical devices or therapies. When these interventions are removed, the body is unable to support itself, so the person dies. We can predict a timeframe from experience. For instance, we know that, if someone is dependant on dialysis, and we stop dialysis, they will die within a couple of days, because we've seen it happen a thousand times before. We, as a profession, know from experience what a body can survive and what it can't survive.   Regardless of cause of death, there are certain indicators that tell us that death is imminent. Someone who is actively dying will usually start refusing food and drink. They will be in and out of consciousness. Their breathing changes. Their vitals (blood pressure, heart rate, oxygen levels) start to change. Their hands and feet start to feel cooler. They stop producing urine.   Despite this, we don't always get it right.","When you work with the dying, you start to notice similarities in colors of various body parts, smells coming off the client and you see a decided decrease in bodily functions as you see the shutting down mentioned in the other answers. You also almost always see a noticeable cognitive decline the days and sometimes weeks before and they tend to know themselves too and often will tell you as much.  Edit: blood tests will give docs an idea of when organ failure is starting too based on the function numbers.",1,5.75
Explain like I'm five years old: Why do we still need to bring our license and registration to drive? Considering it's 2017 and we have enough technology to have all this information in the cloud / in our phones and match with the cops information.,271,1233,"1) Not everyone has a phone and they cannot legally require you to purchase one.   2) Even if you have a phone they cannot legally require you to have an app or connect your data to it.   3) There are large stretches of the country without cell service. This would render your system useless in those areas.   4) Many would not be willing to hand their phone over to a police officer. The potential for data being stolen is too high. You also have to hand it over when purchasing alcohol, going to bars, going to R rated movies, etc. There is just too much risk to have ID being digital.   5) Having it be digital means it is more vulnerable to attack, and corruption.","Actual cop here when I ask for license and registration ti'm really asking for each for a different purpose. I ask for your license because a lot of times the driver isn't the registered owner of the car.  Sure I can look it up by name/dob, but the card lets me compare faces right there. You can give me someone's name/dob that looks super similar to you, and get away with it. Most fake IDs are easy as hell to spot. Once I get someone's license I don't even bother to look at the dates on it, I just run their license number through NCIC to make sure it is valid.  I ask for registration for the sole purpose of showing people their shit is actually expired. I know it is expired because I already ran it before I pulled you, but 99% of the time I'll get a ""it can't be expired"" or ""there is no way it has been expired that long"". If they've already dug out the registration is can literally point to it and end that line of argument.  Another good thing about asking for documents is that it is great for getting people who are drunk/high. Most can get their IDs just fine, but I've yet to see a drunk get their registration right on the first try.",0,4.5498154982
Explain like I'm five years old: why is a chip on a credit card considered ‘safer’ than swiping the magnetic strip?,2266,291,"The magnetic strip is like a secret code that lets you buy things. I can copy your secret code and use it to buy things.  The chip is like a little man who makes secret codes that can each be used to buy one thing. I can copy the secret code but not the little man. Because the secret code only works once and for a limited time, and in one situation, stealing the secret code isn’t useful. You can’t steal the little man without doing a lot of work.","The chip is actually a tiny computer that is powered by the reader.   It has a secret number inside of it that cannot be read. Only the bank knows the number. There's no way to ask it the secret number. Instead, you can only give it another number, and it will do some math on that number and its secret number and tell you another number. That's what happens when you read the card. The bank picks a number and asks the card to respond. The bank does the same math, and if your card has the same secret number it must be legit.  Now, you're probably thinking someone could figure out the secret number by just getting it to do the math enough times. But the numbers involved are so big, this will take too long to be practical, more than 10 years to get enough numbers to have a shred of making a guess. Even with very modern computers. That's longer than your card's expiration date so it's fine.  And if computers get fast enough the math fails, the banks can simply change the chips to use new algorithms and new, bigger numbers that take even longer to crack.",1,7.7869415808
"Explain like I'm five years old: why fish can’t breathe in air despite air having plenty of oxygen If fish use their gills to filter oxygen from water, why can’t they do the same in air?",4,2,"ELY5: Fish have special lungs called gills, which are like a stack of delicate tissue paper, with many layers of thin tissue all sitting next to each other. The surface of each tissue paper needs to not touch its neighbours in order to absorb oxygen from the water. If you soak a stack of tissue paper in water, and then take it out; it will be impossible to peel the tissues apart. This is exactly what happens to fish gills once they leave their water home.","its because the very delicate gills collapse and dry out quickly in air when supported and hydrated by water, and thus the fish effectively suffocates. Its the other side of the coin where we can't breathe underwater because the structures in our lungs are not designed to be able to efficiently take oxygen out of the water that is now surrounding them.  However this depends on the fish in question though. some fish are more hardy and can withstand longer periods outside the water. and some fish have special features that let them partially breath air, such as modifying parts of their digestive tract to function as a lung, using their swim bladder as a modified lung, or developing an entirely separate lung-like organ for use. These fish usually live in areas where water quality can become poor. Surprisingly a large number of popular fish kept in home aquariums have these features, such as Bettas, Gouramis, Plecos, Cory Catfish, Oto Catfish, and Ropefish",1,2.0
