history,score_A,score_B,human_ref_A,human_ref_B,labels,score_ratio
Explain like I'm five years old: What exactly is phlegm and why/how does the human body produce so much of it?,5,2,"Mucous is mostly made up of water, and is given its properties by long, grippy protein strands. The protein acts like a mop, but much better. I can hold on to itself very well, along with water, and even more water between the strands. Your body has lots of water, and it takes a very small amount of protein to make mucus. So unless you're severely dehydrated, or on the verge of death by malnutrition, you have an endless supply of phlegm.","Phlegm aka mucus of the respiratory tract is a very useful substance.    First lungs need to be wet so that oxygen can go into the body and carbon dioxide can go out.  Mucus is good for this because it is thick like mayonnaise and won't immediately run down and pool in the bottom of your lungs.  But even a jar of mayonnaise that you have shaken will eventually run down to the bottom of the jar.   So secondly, to avoid this, our respiratory tract is lined with little hairs that can move and paddle the mucus upwards.  This is great because in addition to preventing the mucus from pooling at the bottom of your lungs, it actually paddles the mucus up from your lungs and into your throat where it goes into your stomach.  This leads to the third great thing about mucus because it helps to keep our lungs clean.  All that dust in the air will collect in your lungs much like it collects in your house.  That mucus traps the dust and it is pushed out of your lungs and into your stomach where you can eventually get rid of it by pooping.",1,2.5
"Explain like I'm five years old: If soap breaks down oil, why can’t oil be broken down with soap and then diluted to go down the drain?",128,18,"Soap/detergents don't break oil down.  They simply emulsify it, or hold it in suspension.  It is still 100% oil, just distributed differently... in the water rather than on the water.","It can, and is, all the time.  Do you ever wash your dishes?  Wash a pan you cooked with?  When you do that, you use dish soap, and then the soap helps break down the oils, and washes down the drain.    If you've ever worked on a car and got your hands all greasy, then you go inside and you use hot water and soap and you wash your hands really good, all those oils go down your drain.  Where you run into problems, is when people pour oil and grease down their drain.  Because it's not diluted enough, and it will then solidify in your pipes and cause them to clog.  Then you pay big bucks to have it fixed.",1,7.1111111111
"Explain like I'm five years old: Why don't you hear about ""fair trade"" or ""single source"" when it comes to hop farmers for beer and grape farmers for wine, but you hear it all the time when it comes to coffee bean farmers? You always hear about coffee bean farmers getting ripped off and the initiative for consumers to help alleviate this issue by only buying fair trade or single source or both. Why don't you hear about these issues with grapes or hops for example?",4,13,"Gapes and grains are both typically grown and harvested in first world countries (not exclusively, but they are widely available) Coffee is grown in very specific regions that are much less developed and coffee workers are known to be exploited heavily by corporations. Not to say that every grape picker and grain farmer is living the american dream, but at least we can regulate what you can and cant do to workers in france or the USA","Much of the world's hops growing happens in Germany and the US, which both have pretty strong laws regulating working conditions. If you're buying a microbrew in the US, the hops likely came from the Yakima River valley in Washington, not some third world country where people are harvesting plants for pennies per day. Same with wine- the top three countries for growing wine grapes are France, Italy, and the United States.   Coffee, however, only grows in tropical climates. So many of the top coffee growing countries- Brazil, Vietnam, Indonesia, and Colombia- have less strong worker protections, and a bigger history of worker exploitation. You can look up the history of the term ""banana republic"" to see some of the problems countries like this can have.",0,3.25
Explain like I'm five years old: How come humans are disgusted by the idea of eating food that's already been chewed by someone else but animals have no problem with it?,8,3,Humans are aware of the bacteria/viruses that inhabit our mouths. Humans are also distrusting of how clean someone else's mouth may be.,Because we know about germs.  And it's taught to us at from a young age not to eat after other people.,1,2.6666666667
Explain like I'm five years old How do chip manufacturers keep their IP from being reversed engineered. How do chip manufacturers keep their IP from being reversed engineered? Is it too difficult for other companies to understand how the chips and boards were made and try to come up with how to make it themselves?,2,4,"Reverse engineering the process of how a chip was made is next to impossible. It's like 3D printing at a microscopic level with a plethora of different chemicals, metals and lasers. Then you have to scale and replicate while also having similar precision to what you're trying to copy. You'd have to have detailed data and plans and a lot of them copied, to get something that could be similar. Also lots of money.",I worked at Mostek in the 70s and 80s and we reverse engineered the 8086 and 68000 families.  Our RAM and calculator chips were copied by many others. There was no law against it as copyright only covered the aesthetics and not function.  Congress passed a law allowing copyright of photomask's and that ended it.,0,2.0
"eli5: Why do most racing vehicles (F1, IMSA etc) lose control immediately the second they touch grass where a 'passenger' car would retain some control?",12,4,"Racing cars can handle grass.  Here's a F1 car passing another on grass.  https://www.youtube.com/shorts/nzNZZiM8pjY  It seems like racing cars spin so easily on grass because they're often already operating near the limits of the vehicle on the road where there's more grip.  If they're turning as fast as possible, then suddenly lose half the grip by hitting grass, they are now going too fast to turn.  Acceleration and braking are challenging in the grass, because the car ends up with most the force on one side, making it want to spin.  Also, the grass can be very bumpy compared to a road, which makes it harder for tires to maintain good contact.  Typically, when someone takes a road car onto the grass, it doesn't happen unplanned while going as fast as possible.  Or with three times the power and half the weight of a normal car.     Road cars can lose control quite easily in the grass when speeds are high and aggressive maneuvers are taken. https://youtu.be/pA7BASFqXIw Skip ahead to 2:15","Keep in mind race cars are going like 150+ mph.  The forces needed to turn the car at those speeds are immense, and the grass and soil will sheer off under load, which limits how much grip they can have. While some forces are imparted and the car will turn slightly, it won't be perceptible compared to the car going 150+ mph off line.  A race car driving at slower speeds will have plenty of grip, just like your car, and you will see cars rejoining the track through grass, like in NASCAR or F1.  If you want to see why race cars lose grip, drive your own car at 150 mph over grass and try to turn.",1,3.0
"Explain like I'm five years old: Why aren't cigarettes/tobacco a ""schedule 1"" drug, if they are scientifically proven to cause hundreds of thousands of deaths each year?",37,3,Scheduling of drugs is not done solely based on the scientific evidence. Political and economic concerns play a role.,"What 59179 said, but also because it is so widespread and in common usage, trying to limit it outright could lead to huge backlash (think prohibition). The good news is they're slowly phasing it out though, and finally getting more and more regulations in place.",1,12.3333333333
"Explain like I'm five years old:What is it about doing actual homework, studying, work etc, that makes us not want to do it? Why do I have no problem""reading"" stuff on reddit, but dread reading my homework which is arguably equally as interesting! I would imagine it has something to do with the psychology behind HAVING to do it, versus reading things on reddit is by my own choice....any insight?  Maybe the answer will help improve my productivity and help me with this problem of getting distracted",23,9,"For me it's about reward.  I have no problem at all working until super late to close a deal if necessary. Why? Because there is a real tangible reward coming soon.  With homework? The reward is nothing more than your grade fluctuating a few points. Even with all the homework, 16+ YEARS worth, your reward at the end of the day is what? A piece of paper that doesn't even remotely guarantee anything?  It's difficult to give incentives to homework. Even if you've never gotten below a 95% in your entire life and scored a 2400 on the SATs, big deal. You're still being passed over in favor of someone who knows someone, a minority, or someone whose parents also went to the school and they donated some money. Basically, somehow subconsciously, we don't see a point to it.  Speaking of point - most of the homework given in school, especially k-12, is busy work. We don't care about half the stuff we learned in school. It will not apply in the least to our actual life. In real life we have computers and calculators. In real life if you DON'T use them, you will get in trouble. If it's not documented with a source, it might as well not even exist. No one wants to hear ""oh, from I remember in school, I think this is done this way"". So really, why bother drilling it into our heads?   In school I always hated English classes. It was always the same thing. Read some stupid fiction book, write what the teacher wants to hear, move on to the next book. Guess what happened? I have not read a fiction book since my second year of college. I hate fiction books with a burning passion. I do love to read - I'm a bit over halfway through reading a 600something page technical text - again for fun. I dreaded doing it because I thought it was nothing more than busy work.","We are cognitively lazy. Reading reddit requires minimal effort for stimulation, while homework and such requires use of cognitive resources and effort.  The fix is willpower and training good work habits.",1,2.5555555556